{"id":"MAT-9014","schemaVersion":"0.1.0","recordVersion":"0.1.0","revision":0,"status":"Draft","createdAt":"2026-01-01T00:00:00Z","createdBy":"test-suite","updatedAt":"2026-01-01T00:00:00Z","updatedBy":"test-suite","sourceLinks":[],"changeSummary":"Fictional Material validation fixture.","name":"Example Material Xi","replaces":"MAT-8999"}
